{
  "$schema": "https://json-schema.org/draft/2020-12/schema",
  "$id": "https://srs.semanticops.com/schema/2.0/note.json",
  "title": "SRS Note (Tier 0)",
  "description": "A lightweight instance with no Type binding. The lowest-ceremony entry point in SRS.",
  "type": "object",
  "required": ["instanceId", "sections"],
  "additionalProperties": false,
  "properties": {
    "$schema": { "type": "string" },
    "instanceId": {
      "type": "string",
      "format": "uuid"
    },
    "title": { "type": "string" },
    "tags": {
      "type": "array",
      "items": { "type": "string", "minLength": 1 },
      "description": "Free-form topic labels for discovery and filtering. Not semantically defined; use Relations for semantic claims."
    },
    "sections": {
      "type": "array",
      "items": { "$ref": "#/$defs/NoteSection" },
      "description": "Ordered list of named text sections."
    },
    "sourceRefs": {
      "type": "array",
      "items": { "$ref": "#/$defs/SourceReference" },
      "description": "References to source material from which this Note was derived."
    },
    "createdAt": { "type": "string", "format": "date-time" },
    "createdBy": {
      "$ref": "#/$defs/Actor",
      "description": "RFC-046. The actor that created this instance, stamped by the implementation from the session actor at creation and never taken from a request. Optional: absent means unattributed, never invalid, and no actor is inferred. Set once and preserved by every other operation. Testimony, never authority: it never affects validity."
    },
    "updatedAt": { "type": "string", "format": "date-time" },
    "meta": {
      "type": "object",
      "description": "Implementation-local key-value pairs. Cross-system keys should be namespaced."
    }
  },
  "$defs": {
    "Actor": {
      "type": "object",
      "description": "RFC-046 [R1]. Who performed an act. Exactly kind and id are required; no other property is allowed. The $defs/Actor entry is repeated byte-identically in record.json, note.json and relation.json (checked by scripts/check-actor-defs-identical.mjs). Testimony, never authority: it informs trust and diagnosis and never affects validity (RFC-046 [R8]).",
      "required": ["kind", "id"],
      "additionalProperties": false,
      "properties": {
        "kind": {
          "type": "string",
          "enum": ["human", "ai"],
          "description": "human: a person stands directly behind the act. ai: an AI agent performed it, even when a person started or supervises it. These are the actor values of FieldMeta.source: one actor vocabulary (RFC-046 [R9])."
        },
        "id": {
          "type": "string",
          "minLength": 1,
          "description": "Stable, opaque identifier issued by whatever authenticated the session. Compared by exact string equality and carries no other meaning (RFC-046 [R7])."
        },
        "name": {
          "type": "string",
          "description": "Display label captured when the stamp was made. A hint only: it may go stale and never identifies; on disagreement the id wins."
        }
      }
    },
    "NoteSection": {
      "type": "object",
      "required": ["name", "content"],
      "additionalProperties": false,
      "properties": {
        "name": {
          "type": "string",
          "description": "Section key; unique within the Note; snake_case recommended."
        },
        "label": { "type": "string" },
        "content": { "type": "string" },
        "contentHint": {
          "type": "string",
          "enum": ["text", "markdown", "plain"],
          "description": "Hint only; default: text."
        },
        "tags": {
          "type": "array",
          "items": { "type": "string", "minLength": 1 },
          "description": "Section-level topic labels; supplements or narrows Note-level tags."
        }
      }
    },
    "SourceReference": {
      "type": "object",
      "required": ["sourceType", "sourceId"],
      "additionalProperties": false,
      "allOf": [
        {
          "if": {
            "properties": { "sourceType": { "const": "repository-document" } },
            "required": ["sourceType"]
          },
          "then": {
            "properties": { "sourceId": { "format": "uuid" } }
          }
        }
      ],
      "properties": {
        "sourceType": {
          "type": "string",
          "enum": ["transcript-chunk", "transcript-segment", "external-document", "repository-document"],
          "description": "'repository-document' is added by ext:repository."
        },
        "sourceId": { "type": "string", "description": "Free-form when sourceType is transcript-chunk/transcript-segment/external-document. When sourceType is repository-document, MUST be a SourceDocument.documentId (format: uuid, RFC-017) — enforced by the sibling if/then." },
        "sourceStandard": { "type": "string" },
        "streamId": { "type": "string", "format": "uuid" },
        "sourceRole": {
          "type": "string",
          "enum": ["evidence", "extracted-from", "quoted-from", "inspired-by", "attaches"],
          "description": "The role the source material plays for this instance (RFC-023). Replaces relationType. 'attaches' added by RFC-017: material attachment of a source document to a record (RFC-017 [R1])."
        },
        "confidence": { "type": "number", "minimum": 0, "maximum": 1 },
        "note": { "type": "string" }
      }
    }
  }
}
